{
  "schemaVersion": 2,
  "profile": "complete-layer",
  "id": "BG-WORKSPACE-DRINK",
  "sourceRevision": 2,
  "screenUnit": "SCR-SVC-DRINK",
  "semanticPurpose": "D1 drink base state의 인물·UI·station 없는 opaque full-frame indoor-only workspace background",
  "status": "approved-by-user",
  "sourceReferences": [
    {
      "file": "../../../../../concept-masters/2026-07-26/06_drink-station-master.png",
      "sha256": "667e8f704c74f6515e1a401fc4e2e0981545226fb42ce3f6916e9624fa183ee2",
      "role": "read-only CM-DRINK-STATION-R1 spatial and lighting reference"
    }
  ],
  "generation": {
    "tool": "approved R2 delivery raster; no post-approval pixel edit",
    "mode": "complete-layer R2 indoor-continuity correction",
    "promptSummary": "fixed side/down drink workspace camera에서 좌우 실내 timber wall·shelving·storage와 빈 workspace만 남긴 opaque z0 배경",
    "rawChromaSource": "../../../../../concept-masters/2026-07-26/06_drink-station-master.png",
    "rawChromaSourceSha256": "667e8f704c74f6515e1a401fc4e2e0981545226fb42ce3f6916e9624fa183ee2",
    "rawChromaSourceBytes": 2529664,
    "postProcess": [
      "PM-approved topology wording correction only; R2 decoded pixels unchanged",
      "final approval records opaque 1920×1080 R2 without a separate 720 crop",
      "runtime build B1 is lossless passthrough"
    ]
  },
  "output": {
    "file": "../assets/bg-workspace-drink-r2.png",
    "sha256": "a30b2d44635ba52eef5d5461d4ea9b86ea80a2ab12e47f5377b58279dddeafce",
    "bytes": 2859834,
    "width": 1920,
    "height": 1080
  },
  "approval": {
    "status": "approved-by-user",
    "date": "2026-07-30",
    "basis": "사용자 최종 소비 화면 승인: R2 a30b…afce, FHD c6f2…789c, 720 fbc5…b87e, 좌우 실내 연속면·외부 개구부 없음·body=0·raster UI=0·station=0; harness DOM은 배경 승인 대상이 아님."
  },
  "runtimeRegistrationAllowed": false
}
